id,created_at,updated_at,name,image_url,color,emotion_1,emotion_2,emotion_3,fact,is_featured,safety_information_id,page_number,sort_order,Spanish Fact,Portuguese Fact,descriptor Spanish 1,descriptor Spanish 2,descriptor Spanish 3,descriptor Portuguese 1,descriptor Portuguese 2,descriptor Portuguese 3
41,2018-08-29 20:57:48,2018-12-05 14:54:48,Rescuer™,blends/e20f99036f261762585752afe3883b36.jpeg,22428E,Alleviating,Calming,Comforting,"Children’s blends are uniquely formulated to offer younger users a positive essential oil introduction by using milder aromas and careful plant selection to avoid unnecessary sensitization in immature, thin skin and smaller bodies. Intentional early introduction is the perfect way to empower children to safely learn personal application methods and experience the power of healthy, nurturing touch and gentle massage with caregivers.",1,2,172,0,Las mezclas para niños están formuladas exclusivamente para ofrecer a los usuarios más jóvenes una introducción positiva de aceites esenciales mediante el uso de aromas más suaves y una cuidadosa selección de plantas para evitar la sensibilización innecesaria en pieles jóvenes y delgadas y en cuerpos más pequeños. La introducción temprana intencional es la manera perfecta de capacitar a los niños para que aprendan de manera segura los métodos de aplicación personal y experimenten el poder de un tacto saludable y afectuoso y un masaje suave con los cuidadores.,"As misturas para as crianças são formuladas unicamente para oferecer aos consumidores jovens uma introdução positiva de óleo essencial, utilizando aromas mais suaves e uma seleção cuidadosa de plantas para evitar sensibilização em peles imaturas, finas e em corpos menores. A introdução precoce intencional é a forma perfeita para empoderar as crianças a aprender métodos de aplicação pessoais e vivenciar o poder do toque saudável e acolhedor e da massagem gentil dos cuidadores.",Aliviar,Acalmar,Confortar,Atenuante,Calmante,Reconfortante
42,2018-08-29 21:00:14,2019-01-16 08:54:19,Arise™,blends/adc4238bffe6b82337ab06cdd1ebc9e5.jpeg,00B0D9,Rising,Connecting,Aligning,Affirmation statement: I am one with the divine.,1,60,178,0,Declaración de afirmación: Me identifico con lo maravilloso.,Afirmação: Eu sou único com o divino.,Subir,Conectar,Alinhar,De crecimiento,De conexión,Equilibrante
43,2018-08-29 21:02:45,2018-12-05 14:54:48,Holiday Joy®,blends/39f6f7c79f7aa48a58dcebe9911cf462.jpeg,AB1123,Festive,Warming,Spicy,This blend inspires the joy of the holidays while also stimulating immunity.,0,73,181,0,Esta mezcla inspira la alegría de las vacaciones al mismo tiempo que estimula la inmunidad.,Esta mistura inspira a alegria das férias ao mesmo tempo que estimula a imunidade.,Festivo,Reconfortar,Picante,Alegre,Cálido,Aromático
44,2018-08-29 21:05:08,2018-12-05 14:54:48,Amavi®,blends/ec9a3032dcd892d678ccb11a52745d65.jpeg,FF7519,Strengthening,Woody,Fearless,Replacing colognes that are made using synthetic chemicals with essential oils is a great way to choose to live a healthier lifestyle.,0,2,186,0,Reemplazar las colonias hechas con productos químicos sintéticos por aceites esenciales es una buena manera de elegir un estilo de vida más saludable.,Substituir as colônias feitas com produtos químicos sintéticos por óleos essenciais é uma forma ótima para escolher viver um estilo de vida mais saudável.,Fortalecer,Amadeirado,Destemido,Fortalecedor,Amaderado,Valiente
45,2018-08-29 21:07:08,2019-01-16 08:51:43,Anchor®,blends/e235aedf8ad680705a87185e6526c825.jpeg,56C7B6,Stabilizing,Harmonizing,Centering,Affirmation statement: I am living who I really am.,1,2,196,0,Declaración de afirmación: Estoy viviendo lo que realmente soy.,Afirmação: Eu estou vivendo quem eu realmente sou.,Estabilizar,Harmonizar,Centralizar,Estabilizador,Amonizador,Equilibrante
46,2018-08-29 22:43:32,2018-12-05 14:54:48,Whisper®,blends/de333db4505fc19d9e0b5758aa1d57a3.jpeg,7FC8F0,Fresh,Balancing,Cleansing,Each woman’s unique body chemistry makes the scent of this blend her own.,0,60,200,0,La química corporal única de cada mujer permite que el aroma de esta mezcla sea propio.,A química do corpo de cada mulher é única e torna sua a fragrância desta mistura.,Fresco,Equilibrar,Limpeza,Fresco,Equilibrante,Limpiador